<?xml version="1.0" encoding="UTF-8" ?>
<!DOCTYPE configuration
        SYSTEM
        "minimybatis\src\main\java\com\lzp\mybatis\parsing\mybatis-1.0-config.dtd">
<configuration>
    <environment default="dev">
        <dataSource id="dev">
            <property name="driver" value="com.mysql.jdbc.Driver"/>
            <property name="url" value="jdbc:mysql://localhost:3306/minimybatis"/>
            <property name="username" value=""/>
            <property name="password" value=""/>
        </dataSource>
    </environment>
    <mappers>
        <mapper resource="com/lzp/dao/UserMapper.xml"/>
    </mappers>
</configuration>